<?xml version="1.0" encoding="UTF-8"?>
<racuni_banaka xmlns:xsi="http://www.w3.org/2001/XMLSchema-instance"
    xsi:noNamespaceSchemaLocation="file:/C:/Users/Geek/Documents/XWSBezbednost/XMLProject/WEB-INF/scheme/racuni_banaka.xsd">
    <kod_banke swift='AAAARS01'>
        <racun_banke>111-1231231231231-32</racun_banke>
        <id>001</id>
        <naziv>A Banka</naziv>
    </kod_banke>
    <kod_banke swift='BBBBRS01'>
        <racun_banke>111-1231555551231-32</racun_banke>
        <id>002</id>
        <naziv>B Banka</naziv>
    </kod_banke>
    <kod_banke swift='CCCCRS01'>
        <racun_banke>111-1231266661231-32</racun_banke>
        <id>003</id>
        <naziv>C Banka</naziv>
    </kod_banke>
</racuni_banaka>